Country,Description,Designation,Points,Price,State,Region_1,Region_2,Taster_Name,Taster_Twitter,Title,Variety,Winery,Website
US,"Richly textured and sumptuous, this Pinot has cherry, red licorice, cola, pepper and sandalwood flavors that go on into a long, spicy finish. The tannins are silky and integrated. The wine displays the fruit forwardness of the vintage, as well as the careful viticulture of the vineyard. Lovely to drink now with steak, and it will reward cellaring until 2020 to 2022.","Cargasacchi Vineyard",93,50,California,"Sta. Rita Hills","Central Coast",NULL,NULL,"Loring Wine Company 2012 Cargasacchi Vineyard Pinot Noir (Sta. Rita Hills)","Pinot Noir","Loring Wine Company",www.loringwinecompany.com
US,"Rosella's is in some respects the quintessential Santa Lucia Highlands vineyard. It always shows ripe, concentrated raspberry and licorice fruit, with brooding, earthy notes of mushrooms, as well as thick tannins and bright acidity. Loring's 2012 is a balanced, complex wine that brings hints of blueberries. It's beautiful now, and will age well until at least 2020.","Rosella's Vineyard",93,50,California,"Santa Lucia Highlands","Central Coast",NULL,NULL,"Loring Wine Company 2012 Rosella's Vineyard Pinot Noir (Santa Lucia Highlands)","Pinot Noir","Loring Wine Company",www.loringwinecompany.com
US,"Sensuous beyond words, this beguiling bottle absolutely seduces from the first sniff to the last sip. The amazing bouquet is a dense jumble of raspberry jam, cranberry compôte, orange peel and candied citrus. The flavors bore down deeply into a finish that can only lead you in one direction—to the next glass.","Whole Cluster Cuvée",93,85,Oregon,"Dundee Hills","Willamette Valley","Paul Gregutt",@paulgwine ,"Archery Summit 2014 Whole Cluster Cuvée Pinot Noir (Dundee Hills)","Pinot Noir","Archery Summit",www.archerysummit.com
US,"Set within the smaller Green Valley AVA, Hallberg is 100 acres of varying aspects and weather, much of the site impacted by ocean winds and fog. The wine reflects this in its bright, citrusy acidity and earth, measured by elegant layers of orange, cranberry and strawberry. Cedar and black tea give it an exotic edge.","Hallberg Vineyard Dijon Clones",93,60,California,"Russian River Valley",Sonoma,"Virginie Boone",@vboone,"Gary Farrell 2014 Hallberg Vineyard Dijon Clones Pinot Noir (Russian River Valley)","Pinot Noir","Gary Farrell",www.garyfarrellwines.com
US,"Shows a certain aggressiveness, offering up vibrant raspberry and cherry fruit, cola, mocha and oak flavors, but kept aloof by its acidity and tannins. It's certainly elegant and pedigreed, but it need 3–4 years in the cellar.",Georganne,93,57,California,"Russian River Valley",Sonoma,NULL,NULL,"Merry Edwards 2010 Georganne Pinot Noir (Russian River Valley)","Pinot Noir","Merry Edwards",www.merryedwards.com
US,"Shows the elegantly crisp, almost austere structure of the winery's 2009s, courtesy of the cool vintage. Tight at first in acids and tannins, as it warms it gives off deep layers of sour cherries, cola, pomegranates and rhubarbs, all of them dry, earthy fruits that sing of the soil. Should develop bottle complexity through 2015.","Dutton Ranch - Fox Den Vineyard",93,58,California,"Green Valley",Sonoma,NULL,NULL,"Dutton-Goldfield 2009 Dutton Ranch - Fox Den Vineyard Pinot Noir (Green Valley)","Pinot Noir",Dutton-Goldfield,www.duttongoldfield.com
US,"Silky and voluptuous, Gowan Creek is Goldeneye's larger production Anderson Valley Pinot Noir. Still a barrel selection of its best lots, the wine is made from fruit that's heavily scrutinized before fermentation. A powerful Pinot that retains the acidity and earthiness of the variety, with streaks of ripe fruit throughout.","Gowan Creek Vineyard Estate Grown",93,80,California,"Anderson Valley",NULL,"Virginie Boone",@vboone,"Goldeneye 2010 Gowan Creek Vineyard Estate Grown Pinot Noir (Anderson Valley)","Pinot Noir",Goldeneye,www.goldeneyewinery.com
US,"Sizzling acidity enlivens the succulent, juicy fruit in this lush expression of the appellation. Made from grapes sourced in the Olivet Lane area, it builds in exotic spiciness, with forest, herb, earth and tea accents that grace the foundation of strawberry and blackberry flavors.","Fog Veil",93,65,California,"Russian River Valley",Sonoma,"Virginie Boone",@vboone,"La Crema 2015 Fog Veil Pinot Noir (Russian River Valley)","Pinot Noir","La Crema",www.lacrema.com
US,"The fruit from this marquee site is elusive at first, offering light wisps of rose petal and bay, earthy and spicy in equal waves. Around its richness of tart cherry are elements of pomegranate, orange zest and tea. It's a wine of great complexity and counterbalance, with a lengthy, leathery finish.","Hallberg Vineyard Dijon Clones",93,60,California,"Russian River Valley",Sonoma,"Virginie Boone",@vboone,"Gary Farrell 2013 Hallberg Vineyard Dijon Clones Pinot Noir (Russian River Valley)","Pinot Noir","Gary Farrell",www.garyfarrellwines.com
US,"The Ribbon Ridge AVA is home to a small, select group of near-cult wineries, and fruit such as this is the reason why. Compact and refined, it delivers beautiful aromas of raspberries, with a subtle dustiness that might be Oregon's answer to Napa's famed Rutherford dust. Terrific concentration and pinpoint definition make this a wine to savor immediately, or cellar for enjoyment through 2025 and beyond.","Looney Vineyard",93,85,Oregon,"Ribbon Ridge","Willamette Valley","Paul Gregutt",@paulgwine ,"Archery Summit 2012 Looney Vineyard Pinot Noir (Ribbon Ridge)","Pinot Noir","Archery Summit",www.archerysummit.com
US,"The vineyard from which this wine is sourced sits along the Gualala River in view of the Pacific Ocean, enjoying coastal weather and elevations of up to 1,100 feet. Baked blueberry pie laced with clove is the first impression, supported by bright acidity. Exotic in profile, it imparts cedar and tea notes, its tannins fine yet tenacious.","McDougall Vineyard",93,62,California,"Fort Ross-Seaview",Sonoma,"Virginie Boone",@vboone,"Dutton-Goldfield 2014 McDougall Vineyard Pinot Noir (Fort Ross-Seaview)","Pinot Noir",Dutton-Goldfield,www.duttongoldfield.com
US,"There's a sultry aromatic combination of stewed strawberry and bright raspberry as well as subtle thyme, tarragon, rosewater and French toast on the nose of this bottling from the iconic vineyard. The baked red fruits and hard woody spices are cut by pungent acidity and firm tannins on the sip. Hold off a bit on this one, but then enjoy for decades. Drink 2019–2034.","Pisoni VIneyard",93,100,California,"Santa Lucia Highlands","Central Coast","Matt Kettmann",@mattkettmann,"Patz & Hall 2014 Pisoni VIneyard Pinot Noir (Santa Lucia Highlands)","Pinot Noir","Patz & Hall",www.patzhall.com
US,"There's tons of cherry, cola and licorice flavor in this vigorous young Pinot. It also shows an earthy streak of herbs and mushrooms, suggesting a sautéed Portobello splashed with balsamic. The result is complex and fascinating, yet vigorous tannins and keen acidity warrant time in the cellar. Give it through 2011.","Olivet Lane",93,60,California,"Russian River Valley",Sonoma,NULL,NULL,"Merry Edwards 2007 Olivet Lane Pinot Noir (Russian River Valley)","Pinot Noir","Merry Edwards",www.merryedwards.com
US,"This amazing wine can match up against wines double the price. Brawny red berries and wild cherries mix with cut sagebrush, eucalyptus and crushed graphite on the nose. The palate combines bright red, acid-driven raspberry fruit with the darker structure of elderberry. Throw in thyme and bay leaf for the complete package.",NULL,93,25,California,"Central Coast","Central Coast","Matt Kettmann",@mattkettmann,"Sarah's Vineyard 2013 Pinot Noir (Central Coast)","Pinot Noir","Sarah's Vineyard",sarahs-vineyard.com
US,"This block selection really works, showing more muscle and meat on its bones than the excellent vineyard-designated bottling. Black fruits, cassis and clean earth are flecked with cinnamon. The wine has authority and power, yet retains a sculpted, fine-tuned precision.","Ridgecrest Vineyards Wind Ridge Block",93,50,Oregon,"Ribbon Ridge","Willamette Valley","Paul Gregutt",@paulgwine ,"Chehalem 2011 Ridgecrest Vineyards Wind Ridge Block Pinot Noir (Ribbon Ridge)","Pinot Noir",Chehalem,www.chehalemwines.com
US,"This bold, intense expression of the variety entices with an exuberant nose of white pepper, clove and cardamom scents, a spark of pine needle fragrance just underneath. Tingly acidity provides freshness and added succulence to its otherwise rich texture and black cherry decadence.",NULL,93,65,California,"Green Valley",Sonoma,"Virginie Boone",@vboone,"La Crema 2014 Pinot Noir (Green Valley)","Pinot Noir","La Crema",www.lacrema.com
US,"This floral wine opens as if in a damp but not wet forest, surrounded by ripe, red cherry trees. Likable from the start, it's grippy on the palate, expressively juicy, seductive and refined. Blackberry and dried herb pop on the finish, providing a darker side to the red fruit.","Hallberg Vineyard",93,55,California,"Russian River Valley",Sonoma,"Virginie Boone",@vboone,"Gary Farrell 2013 Hallberg Vineyard Pinot Noir (Russian River Valley)","Pinot Noir","Gary Farrell",www.garyfarrellwines.com
US,"This full-bodied and beautifully flavored wine goes deep in terms of ripe fruit and subtle spices, and has a calm, composed character and ultrasmooth, slightly restrained texture. Delicious black-cherry and currant notes come out in the bouquet, weave through the palate and linger on the finish.","Gowan Creek Vineyard",93,82,California,"Anderson Valley",NULL,"Jim Gordon",@gordone_cellars,"Goldeneye 2013 Gowan Creek Vineyard Pinot Noir (Anderson Valley)","Pinot Noir",Goldeneye,www.goldeneyewinery.com
US,"This is a big, dark and concentrated wine with exotic spicy, oaky aromas, rich and ripe fruit flavors, an absolutely creamy, mouthfilling texture and lingering finish. Deft touches of graphite and cedar in the aromas meet generous black plum, mint and cherry on the palate.","Split Rail Vineyard",93,82,California,"Anderson Valley",NULL,"Jim Gordon",@gordone_cellars,"Goldeneye 2014 Split Rail Vineyard Pinot Noir (Anderson Valley)","Pinot Noir",Goldeneye,www.goldeneyewinery.com
US,"This is a bold and expressive but not overly big wine. It smells wonderfully like clove and coriander, and tastes generously focused on classic black cherry and cedar notes. It's full bodied, but has great acidity and a lively layer of tannins to keep it balanced and refreshing.","Azaya Ranch Vineyard",93,58,California,"Marin County","North Coast","Jim Gordon",@gordone_cellars,"Dutton-Goldfield 2013 Azaya Ranch Vineyard Pinot Noir (Marin County)","Pinot Noir",Dutton-Goldfield,www.duttongoldfield.com
US,"This is a fabulous example of a light, balanced wine from the Santa Lucia Highlands, which is perhaps better known for richness. It shows savory aromas of smoked cherries, nose-tickling sage, juniper-laced sausage and cayenne pepper. The palate is energetic, with a pleasant viscosity that carries its cranberry, cherry, thyme, oregano and sandalwood flavors into the finish.",NULL,93,38,California,"Santa Lucia Highlands","Central Coast","Matt Kettmann",@mattkettmann,"Sarah's Vineyard 2015 Pinot Noir (Santa Lucia Highlands)","Pinot Noir","Sarah's Vineyard",sarahs-vineyard.com
US,"This is a very dry, elegant Pinot Noir that's sleeker and earthier than many other comparably priced Pinots out there. It has what you might call a Burgundian profile, with the cherry, raspberry, cola and spice fruit balanced by truffles, leather and a suggestion of dried pine needles.","Brosseau Vineyard",93,50,California,Chalone,"Central Coast",NULL,NULL,"Loring Wine Company 2006 Brosseau Vineyard Pinot Noir (Chalone)","Pinot Noir","Loring Wine Company",www.loringwinecompany.com
US,"This is a well-structured, dense and serious effort, with ripe immaculate black-cherry fruit. It is both forward and fruit-driven, yet polished and showing substantial depth. Hints of cola swirl through the extended finish. Delicious already, it will certainly drink well over the next eight to 10 years.","Red Hills Estate",93,100,Oregon,"Dundee Hills","Willamette Valley","Paul Gregutt",@paulgwine ,"Archery Summit 2014 Red Hills Estate Pinot Noir (Dundee Hills)","Pinot Noir","Archery Summit",www.archerysummit.com
US,"This is a Westside Road site known for its rocky soils, and the wine presents sassafras, cherry-berry and roses on the entry before laying down a tightly woven mix of sour, salty cranberry and blood orange. It is softly voluptuous and velvety, though young, with a biting chewiness that should mellow in the cellar. Drink now through 2028.","Flax Vineyard",93,57,California,"Russian River Valley",Sonoma,"Virginie Boone",@vboone,"Merry Edwards 2013 Flax Vineyard Pinot Noir (Russian River Valley)","Pinot Noir","Merry Edwards",www.merryedwards.com
US,"This is currently very dry and austere due to its tannins, but it's impressive for its noble structure and deep, complex flavors of blackberries, cranberries, brown sugar and spices.- With such depth and a long finish, it's clearly a cellar candidate. Don't even think about opening it until 2017, at least.","Rochioli Vineyard",93,65,California,"Russian River Valley",Sonoma,NULL,NULL,"Gary Farrell 2009 Rochioli Vineyard Pinot Noir (Russian River Valley)","Pinot Noir","Gary Farrell",www.garyfarrellwines.com
US,"This is one of the most successful Pinots the winery has produced, and I have no doubt it's because the vintage was so cool. The wine is absolutely dry and has bracing acidity, with extraordinarily long, deep flavors of grapes that achieved maximum ripeness but remain balanced. Cherries, raspberries and blackberries flood the palate, enriched with earthier notes of balsam, cola, soy, licorice and spice. Drink now through 2011.","Chenoweth Ranch",93,55,California,"Russian River Valley",Sonoma,NULL,NULL,"Patz & Hall 2005 Chenoweth Ranch Pinot Noir (Russian River Valley)","Pinot Noir","Patz & Hall",www.patzhall.com
US,"This new wine from an estate vineyard is the strong, quiet type that's not effusively fruity but instead emphasizes mineral elements and great structure. An attractive chalky, spicy aroma leads to beautifully restrained red cherry and pomegranate flavors that seem to grow and expand with each sip. The texture is firmly tannic but also polished, supported by perfect acidity that keeps everything sharp and focused.",NULL,93,40,California,"Anderson Valley",NULL,"Jim Gordon",@gordone_cellars,"Long Meadow Ranch 2015 Pinot Noir (Anderson Valley)","Pinot Noir","Long Meadow Ranch",www.longmeadowranch.com
US,"This provides a strong argument that delicate yet flavorful Pinot Noir can indeed come from the Santa Clara Valley. Intriguing and elegant aromas of lavender and violet meet with Earl Grey tea and bergamot on the nose. The palate's light black-plum and black-raspberry fruit are enlivened by purple flowers and a dusting of dried sage.",Reserve,93,60,California,"Santa Clara Valley","Central Coast","Matt Kettmann",@mattkettmann,"Sarah's Vineyard 2014 Reserve Pinot Noir (Santa Clara Valley)","Pinot Noir","Sarah's Vineyard",sarahs-vineyard.com
US,"This successful Pinot Noir from a difficult vintage treads an exciting line: It contains subtle notes of tomato and beetroot, but that vegetativeness only adds an earthy complexity to the ripe flavors of black cherry and plum. It's a fancy, elegant wine to drink now, and should gain traction over the next 5–6 years.","McDougall Vineyard",93,58,California,"Sonoma Coast",Sonoma,NULL,NULL,"Dutton-Goldfield 2010 McDougall Vineyard Pinot Noir (Sonoma Coast)","Pinot Noir",Dutton-Goldfield,www.duttongoldfield.com
US,"This tightly wound wine opens in the glass, with intense, bright acidity that wraps around herbal, minty undertones. Blackberry, raspberry and clove give it plenty of varietal classicism, but it's the strong earthy loam and forest floor that provide intrigue and elegance.","Dutton Ranch Freestone Hill Vineyard",93,72,California,"Russian River Valley",Sonoma,"Virginie Boone",@vboone,"Dutton-Goldfield 2013 Dutton Ranch Freestone Hill Vineyard Pinot Noir (Russian River Valley)","Pinot Noir",Dutton-Goldfield,www.duttongoldfield.com
US,"This wine at the top of the Goldeneye hierarchy conveys a feeling of elegance and full body at the same time. It has spicy, toasted oak aromas, ripe and tasty fruit flavors, a rounded texture and full body. Nuances like ripe blackberry and black cherry are nicely layered with nutmeg and toast for delicious complexity.","Ten Degrees Vineyard",93,115,California,"Anderson Valley",NULL,"Jim Gordon",@gordone_cellars,"Goldeneye 2012 Ten Degrees Vineyard Pinot Noir (Anderson Valley)","Pinot Noir",Goldeneye,www.goldeneyewinery.com
US,"This wine is made in decent quantities, enough to hopefully find, and that's good news, given its quality for the price. Juicy, spicy and just the right amount of herbal, it has sizzling acidity that livens and refreshens the palate, dotted in chocolate-covered cherry, plum and clove.",NULL,93,40,California,"Russian River Valley",Sonoma,"Virginie Boone",@vboone,"La Crema 2014 Pinot Noir (Russian River Valley)","Pinot Noir","La Crema",www.lacrema.com
US,"This wine is produced in microscopic amounts, the result of sourcing grapes from a notoriously difficult-to-farm site. It rewards in flavor: hearty cherry and pomegranate fruit, a crisp, crunchy texture, powerful tannins and oak, and an underlying minerality that presents as elusively as a cloud of fog.","Great Oak Vineyard Suicide Hill",93,60,California,"Russian River Valley",Sonoma,"Virginie Boone",@vboone,"Joseph Swan Vineyards 2013 Great Oak Vineyard Suicide Hill Pinot Noir (Russian River Valley)","Pinot Noir","Joseph Swan Vineyards",www.swanwinery.com
US,"This wine lives and breathes terroir, with the rock and wild herb character of the AVA and the vivid cherry fruit of the vineyard. It's beautifully proportioned, with a vein of cola, a toasty bouquet and a focused finish.","Sojourner Vineyard",93,42,Oregon,"Eola-Amity Hills","Willamette Valley","Paul Gregutt",@paulgwine ,"Owen Roe 2013 Sojourner Vineyard Pinot Noir (Eola-Amity Hills)","Pinot Noir","Owen Roe",www.owenroe.com
US,"This wine needs some coaxing at first to come out of its shell. Once settled, it entices in warming cardamom, clove and damp earth, taking on savory airs. Exuberant as it develops, it offers high-toned cherry and tangerine that surround a silky, subtle body. Hints of spicy cinnamon and white pepper mark the finish.","Rochioli-Allen Vineyards",93,70,California,"Russian River Valley",Sonoma,"Virginie Boone",@vboone,"Gary Farrell 2012 Rochioli-Allen Vineyards Pinot Noir (Russian River Valley)","Pinot Noir","Gary Farrell",www.garyfarrellwines.com
US,"Though not designated as such, this is a reserve-level effort, as noted by the special label (with Owen Roe in large, old-fashioned cursive lettering) and its overall concentration. Dense black fruits are strongly accented with flavors of espresso and baking spices. It's a powerful wine that is already drinking well, and should continue to do so into the late 2020s.","Merriman Vineyard Clandeboye",93,85,Oregon,"Willamette Valley",NULL,"Paul Gregutt",@paulgwine ,"Owen Roe 2014 Merriman Vineyard Clandeboye Pinot Noir","Pinot Noir","Owen Roe",www.owenroe.com
US,"Tight in acidity and tannins now, but very complex, offering a range of cherry, tangerine zest, mushroom, cola and Indian spice flavors that swirl to a long finish. The mouthfeel is delicate, but the power is impressive. Drink now–2015.","Saralee's Vineyard",93,35,California,"Russian River Valley",Sonoma,NULL,NULL,"Joseph Swan Vineyards 2007 Saralee's Vineyard Pinot Noir (Russian River Valley)","Pinot Noir","Joseph Swan Vineyards",www.swanwinery.com
US,"Very dark in the glass, this bottling shows blackberry jam, crushed slate, turned black loam and hot baking spice on the nose. There is prominent structure to the palate, where olallieberry meets with smashed clove, bay leaf, black pepper and vanilla. The acid is seamlessly integrated, so drink 2018–2030.","Russell Family Vineyard",93,50,California,"Sta. Rita Hills","Central Coast","Matt Kettmann",@mattkettmann,"Loring Wine Company 2014 Russell Family Vineyard Pinot Noir (Sta. Rita Hills)","Pinot Noir","Loring Wine Company",www.loringwinecompany.com
US,"Vivacious on the nose, with hibiscus flowers, pomegranate, strawberry, rose petal and cola aromas, this bottling from a historic vineyard is both juicy and delicate at the same time. Vibrant flavors of cranberry, pomegranate, hibiscus and even red melon show on the palate, enhanced by dried fennel, sage and purple flowers.","Bien Nacido Vineyard",93,65,California,"Santa Maria Valley","Central Coast","Matt Kettmann",@mattkettmann,"Gary Farrell 2014 Bien Nacido Vineyard Pinot Noir (Santa Maria Valley)","Pinot Noir","Gary Farrell",www.garyfarrellwines.com
US,"Winemaker Brian Loring's take on this coveted vineyard shows rhubarb, pencil lead and a very clove-y cinnamon aspect on the nose. Raspberries mark the core of the palate, but the edges are speckled with strong herbs, from oregano to juniper. It offers a great mix of fruit and spice.","Rosella's Vineyard",93,50,California,"Santa Lucia Highlands","Central Coast","Matt Kettmann",@mattkettmann,"Loring Wine Company 2013 Rosella's Vineyard Pinot Noir (Santa Lucia Highlands)","Pinot Noir","Loring Wine Company",www.loringwinecompany.com
US,"You can taste Marin's cool climate in the exotic, forest-scented pine needle, wild thyme and bitter cherry flavors of this elegant, complex young Pinot. It's completely dry and savory in acidity. An elusive, subtle, capitivating wine that should do interesting things over the next six years.","Devil's Gulch Vineyard",93,58,California,"Marin County","North Coast",NULL,NULL,"Dutton-Goldfield 2009 Devil's Gulch Vineyard Pinot Noir (Marin County)","Pinot Noir",Dutton-Goldfield,www.duttongoldfield.com
US,"A big, young Pinot Noir that shows brilliant stuffing and complexity, but it's rather heavy and tannic now, and not a wine to open before, say, 2011 at the very least. In its youth it displays rich, jammy flavors of red cherries, raspberries, Dr. Pepper cola, beef jerky and smoky sandalwood, and is very dry. Should evolve slowly through 2015 or beyond.","Starr Ridge Vineyard - Dijon Clones",92,50,California,"Russian River Valley",Sonoma,NULL,NULL,"Gary Farrell 2007 Starr Ridge Vineyard - Dijon Clones Pinot Noir (Russian River Valley)","Pinot Noir","Gary Farrell",www.garyfarrellwines.com
US,"A dash of spicy oak suggests nutmeg and cinnamon in the aroma of this well-balanced, rich and flavorful wine. Cherry, red currant and touches of mint and cedar fill out the palate, and the texture is just firm enough, with fine tannins for great balance.",NULL,92,50,California,"Anderson Valley",NULL,"Jim Gordon",@gordone_cellars,"La Crema 2013 Pinot Noir (Anderson Valley)","Pinot Noir","La Crema",www.lacrema.com
US,"A rich, vital, complex Pinot Noir. Completely dry, with a savory scour of acidity, it treads a fine line between ripe cherries and pomegranates and earthier notes of mushrooms and dried herbs. Lots of terroir in this fine wine, which will take a few years of bottle age.",NULL,92,24,California,Monterey,"Central Coast",NULL,NULL,"La Crema 2009 Pinot Noir (Monterey)","Pinot Noir","La Crema",www.lacrema.com
US,"A single-vineyard wine from Oregon can be a component rather than a complete wine, but here it is an absolute joy. Fragrant and complex, this offers pleasures for both nose and palate, with scents of leaf and spice and herb, leading into a surprisingly dense and textural blend of wild berry, rhubarb, melon and mixed tropical fruits. Fascinating and long, this is a fine example of Oregon Pinot at its most elegant and fascinating.","Corral Creek Vineyard",92,44,Oregon,"Willamette Valley","Willamette Valley","Paul Gregutt",@paulgwine ,"Chehalem 2005 Corral Creek Vineyard Pinot Noir (Willamette Valley)","Pinot Noir",Chehalem,www.chehalemwines.com
US,"A special bottling commemorating Edwards' 40 years as a winemaker, this wine is made from a clonal selection created by her in 1975. The fruit is from both the Coopersmith and Georganne vineyards, made in a tiny amount. Built to age, it wraps earthy dried herbs around cherry, strawberry and boysenberry, with a juicy core of acidity. A forested hint of spearmint dances at its edge, as strong suggestions of bacon and pepper build on the finish. Drink now through 2028.","40th Anniversary",92,96,California,"Russian River Valley",Sonoma,"Virginie Boone",@vboone,"Merry Edwards 2013 40th Anniversary Pinot Noir (Russian River Valley)","Pinot Noir","Merry Edwards",www.merryedwards.com
US,"A special, 25th anniversary bottling, this is a knockout. Dark, smoky and tannic, this has a deep, black fruit flavor, threaded with rich streaks of licorice, coffee and chocolate. Further detail comes in the form of peppery herb. This is thick, muscular and integrated.",RR,92,69,Oregon,"Ribbon Ridge","Willamette Valley","Paul Gregutt",@paulgwine ,"Chehalem 2009 RR Pinot Noir (Ribbon Ridge)","Pinot Noir",Chehalem,www.chehalemwines.com
US,"A strong, punchy Pinot Noir, ungainly now for its immaturity, showing tons of jammy raspberries and cherries. The acidity is tart, which is good in a wine this rich, providing balance, and there's also a scour of tannins. All indications suggest cellaring this wine for at least six years.","Stiling Vineyard",92,50,California,"Russian River Valley",Sonoma,NULL,NULL,"Gary Farrell 2010 Stiling Vineyard Pinot Noir (Russian River Valley)","Pinot Noir","Gary Farrell",www.garyfarrellwines.com
