Country,Description,Designation,Points,Price,State,Region_1,Region_2,Taster_Name,Taster_Twitter,Title,Variety,Winery,Website
US,"A remarkable shade of slightly purple bubblegum, Kathy Joseph's wine shows strawberries and buttery croissants on the nose. The flavors are boisterous and nearly effervescent, with berries, yeast and a long-lasting sense of strawberry mousse. This one goes down all too easy.","Pink Fiddle Rosé of",91,22,California,"Sta. Rita Hills","Central Coast","Matt Kettmann",@mattkettmann,"Fiddlehead Cellars 2014 Pink Fiddle Rosé of Pinot Noir (Sta. Rita Hills)","Pinot Noir","Fiddlehead Cellars",www.fiddleheadcellars.com
US,"Acidity dominates this wine, giving it a tartness—like a squeeze of lime juice. Past that is an enormously rich, dry, vibrant wine, explosive in raspberries, cherries and ripe, sweet persimmons. New French oak, with its caramel-like toastiness, is perfectly in keeping with the wine's volume. It's a bit disjointed now, but give it 3–4 years in the cellar, and it should come around.","Dutton Ranch Freestone Hill Vineyard",91,72,California,"Russian River Valley",Sonoma,NULL,NULL,"Dutton-Goldfield 2010 Dutton Ranch Freestone Hill Vineyard Pinot Noir (Russian River Valley)","Pinot Noir",Dutton-Goldfield,www.duttongoldfield.com
US,"Acidity marks this ripe, delicious wine, giving it a tartness that works to balance the extraordinarily ripe flavors. Cherries, black raspberries, mulberries and pomegranates all mingle together, with spice and cedar complications, and the finish is totally dry and somewhat tannic. Great now, and should hold for a good six years.",NULL,91,36,California,"Sonoma Coast",Sonoma,NULL,NULL,"Merry Edwards 2006 Pinot Noir (Sonoma Coast)","Pinot Noir","Merry Edwards",www.merryedwards.com
US,"An elegant blend from different estate vineyards, this widely available cuvée brings sturdy tannins and red currant fruit, highlighted with pretty baking spices. It would be an ideal match for roast duck with an orange sauce.","Premier Cuvée",91,54,Oregon,"Willamette Valley","Willamette Valley","Paul Gregutt",@paulgwine ,"Archery Summit 2013 Premier Cuvée Pinot Noir (Willamette Valley)","Pinot Noir","Archery Summit",www.archerysummit.com
US,"An elegant wine with sculpted berry fruit flavors, this is compact and persistent. A touch of citrus accompanies generous allspice and baking-spice highlights. The lengthy finish brings hints of sandalwood and caramel.","Roads End",91,45,Oregon,Oregon,"Oregon Other","Paul Gregutt",@paulgwine ,"Carlton Cellars 2012 Roads End Pinot Noir (Oregon)","Pinot Noir","Carlton Cellars",www.carltoncellars.com
US,"An enticing cedar and cinnamon aroma leads to robust spiced plum flavors and a lively combination of fine tannins and good acidity for balance. This is a bold, flavorful and ripe-tasting wine that also stays poised and appetizing. Not shabby at all and it should improve through at least 2020.","Graham Family Vineyard",91,50,California,"Russian River Valley",Sonoma,"Jim Gordon",@gordone_cellars,"Loring Wine Company 2014 Graham Family Vineyard Pinot Noir (Russian River Valley)","Pinot Noir","Loring Wine Company",www.loringwinecompany.com
US,"An estate bottled Pinot, this wine is inviting in floral and fruity characteristics, offering concise layers of red cherry, rose petals and a spark of oak that builds in intensity through the finish. This is a nice place to start on the winery's lineup of Carneros-Napa Valley Pinot Noir.","Brown Ranch",91,72,California,Carneros,Napa-Sonoma,"Virginie Boone",@vboone,"Saintsbury 2012 Brown Ranch Pinot Noir (Carneros)","Pinot Noir",Saintsbury,www.saintsbury.com
US,"Aromas of baked sour cherry tart precede pleasing wafts of violet and lavender. From a vineyard planted largely to a field selection of the Swan clone, it offers an expected earthiness and spiciness that intrigues around a core of balanced tension between fruit, acid and oak.","Stiling Vineyard",91,55,California,"Russian River Valley",Sonoma,"Virginie Boone",@vboone,"Gary Farrell 2012 Stiling Vineyard Pinot Noir (Russian River Valley)","Pinot Noir","Gary Farrell",www.garyfarrellwines.com
US,"Baked plum, red cherries, dried sage and a touch of gingerbread show on the nose of this appellation blend. Fresh and fruity red cherry and ripe pomegranate pop on the palate, where wet dirt, black sage and thyme combine for a very complex sip.","Partners' Reserve",91,39,California,"Santa Cruz Mountains","Central Coast","Matt Kettmann",@mattkettmann,"Soquel Vineyards 2013 Partners' Reserve Pinot Noir (Santa Cruz Mountains)","Pinot Noir","Soquel Vineyards",www.soquelvineyards.com
US,"Black cherry, clove, allspice and fresh hibiscus make for an enticing nose on this wine by the longtime Russian River Valley producer. Rose petals, cranberry juice, dried oregano and more hibiscus together for a bountiful palate.","Bien Nacido Vineyard",91,65,California,"Santa Maria Valley","Central Coast","Matt Kettmann",@mattkettmann,"Gary Farrell 2013 Bien Nacido Vineyard Pinot Noir (Santa Maria Valley)","Pinot Noir","Gary Farrell",www.garyfarrellwines.com
US,"Bright and wound up tight, this single-vineyard entry offers nicely-focused raspberry and cherry fruit. Brief barrel aging has added a touch of chocolate around the tannins.","Lenné Vineyard",91,55,Oregon,"Willamette Valley",NULL,"Paul Gregutt",@paulgwine ,"Owen Roe 2012 Lenné Vineyard Pinot Noir","Pinot Noir","Owen Roe",www.owenroe.com
US,"Comprised of ripe raspberry and cherry fruit; sweet, smoky new oak; and brisk, citrusy acidity; this dry Pinot Noir is fine and elegant. As for its ageability, all suggestions are to drink it over the next four years, before the fruit drops out.","Azaya Ranch Vineyard",91,58,California,"Marin County","North Coast",NULL,NULL,"Dutton-Goldfield 2010 Azaya Ranch Vineyard Pinot Noir (Marin County)","Pinot Noir",Dutton-Goldfield,www.duttongoldfield.com
US,"Cranberry and strawberry make for a pretty, fruity wine that's velvety in texture and full bodied in depth and length. Black tea and a backbeat of orange and lemon add to the tartness of this layered, complex red.","Sundawg Ridge Vineyard",91,62,California,"Green Valley",Sonoma,"Virginie Boone",@vboone,"Saintsbury 2014 Sundawg Ridge Vineyard Pinot Noir (Green Valley)","Pinot Noir",Saintsbury,www.saintsbury.com
US,"Deeply brooding notes of crushed violets, rose petals, black cherries, thyme and sagebrush make for a manly take on this often feminine grape. Elderberry fruit shows on the palate, as do more violets and lilacs, dried mint, sagebrush, menthol and pine-needle flavors.",NULL,91,36,California,"Santa Cruz Mountains","Central Coast","Matt Kettmann",@mattkettmann,"Sarah's Vineyard 2014 Pinot Noir (Santa Cruz Mountains)","Pinot Noir","Sarah's Vineyard",sarahs-vineyard.com
US,"Earthy in sage and black tea, this wine is lightly layered and seamless in texture, with an underlying minty flavor. Cardamom and cola provide a spiciness that persists along a road of great length and breadth.",NULL,91,36,California,Carneros,Napa-Sonoma,"Virginie Boone",@vboone,"Saintsbury 2015 Pinot Noir (Carneros)","Pinot Noir",Saintsbury,www.saintsbury.com
US,"Elegance is the keyword for all the wines of DDO, with the added bonus of structure that almost begs for cellaring. This lovely Pinot Noir effortlessly captures the essence of the grape without any heavy-handed oak, alcohol or over-ripeness. Truly Burgundian, a moderate 14% alcohol, it offers seamless integration of berry and plum fruit, natural acids and lightly applied oak accents of sandalwood and toasted cracker.",NULL,91,45,Oregon,Oregon,"Oregon Other","Paul Gregutt",@paulgwine ,"Domaine Drouhin Oregon 2006 Pinot Noir (Oregon)","Pinot Noir","Domaine Drouhin Oregon",www.drouhin.com
US,"From a cool part of the valley, this wine is marked by fresh acids that give it a grapey jamminess. It's very rich in black cherries, black raspberries and toast, and very dry. Feels sharp and angular now. Give it through 2010 to calm down.","Dutton Ranch-Freestone Hill Vineyard",91,58,California,"Russian River Valley",Sonoma,NULL,NULL,"Dutton-Goldfield 2007 Dutton Ranch-Freestone Hill Vineyard Pinot Noir (Russian River Valley)","Pinot Noir",Dutton-Goldfield,www.duttongoldfield.com
US,"From a winery atop Summit Road between Santa Cruz and San Jose comes this wine with a hefty, rich nose of fresh-pressed raspberry, black plum and strawberry notes, boosted by Dr Pepper and light licorice spice. Notes of nutmeg and allspice mix with juniper, dried plum and boysenberry on the lush palate.","Principal's Choice Estate Reserve",91,39,California,"Santa Cruz Mountains","Central Coast","Matt Kettmann",@mattkettmann,"Burrell School Vineyards 2011 Principal's Choice Estate Reserve Pinot Noir (Santa Cruz Mountains)","Pinot Noir","Burrell School Vineyards",burrellschool.com
US,"From the Laguna Ridge neighborhood of the larger appellation, this is a subtle, fuller-bodied wine that's silky and refined in dark cherry, anise and rich earth. Pomegranate and cassis play in the background, the flavors nuanced and complex, with a tangy, citrus-tinged finish.","Martaella Vineyard",91,60,California,"Russian River Valley",Sonoma,"Virginie Boone",@vboone,"Gary Farrell 2013 Martaella Vineyard Pinot Noir (Russian River Valley)","Pinot Noir","Gary Farrell",www.garyfarrellwines.com
US,"From the Pratt Vineyard on Sexton Road, this impressive offering is bold and lush, smoothly textured even in its concentration of thick red cherry and forest. It exalts in a shock of white pepper that is beautiful to behold.","Pratt Vineyard",91,62,California,"Sonoma Coast",Sonoma,"Virginie Boone",@vboone,"Saintsbury 2014 Pratt Vineyard Pinot Noir (Sonoma Coast)","Pinot Noir",Saintsbury,www.saintsbury.com
US,"From two blocks of a vineyard above Freestone that's strongly influenced by the ocean, this wine is marked by leathery pepper, baked cherry and an exotic mix of savory spice. Medium-bodied, it has a density that's both plush and lush.","Dutton Ranch Freestone Hill Vineyard",91,72,California,"Russian River Valley",Sonoma,"Virginie Boone",@vboone,"Dutton-Goldfield 2014 Dutton Ranch Freestone Hill Vineyard Pinot Noir (Russian River Valley)","Pinot Noir",Dutton-Goldfield,www.duttongoldfield.com
US,"Fruit from this 12-acre site has a well-rounded aspect, with nuanced flavors of pomegranate, marionberry, black cherry and cola. Hints of game and cured meat come through also, and the mouthfeel is sleek and wiry. It's drinking well but could certainly be cellared through 2024.","Renegade Ridge Estate",91,85,Oregon,"Dundee Hills","Willamette Valley","Paul Gregutt",@paulgwine ,"Archery Summit 2011 Renegade Ridge Estate Pinot Noir (Dundee Hills)","Pinot Noir","Archery Summit",www.archerysummit.com
US,"Here's a very tight, young Pinot, one you'll want to put some bottle age on. It's marked by acids and oak flavors that have not yet been integrated into the underlying fruit. Give it through 2008, by which time the smoky wood and vanilla should marry with the cherries and Dr. Pepper flavors to produce a rich, complex sipper.","Starr Ridge Vineyard",91,50,California,"Russian River Valley",Sonoma,NULL,NULL,"Gary Farrell 2005 Starr Ridge Vineyard Pinot Noir (Russian River Valley)","Pinot Noir","Gary Farrell",www.garyfarrellwines.com
US,"In 2014 this vineyard designate was further subdivided by clone. The Pommard bottling pushes big fruit front and center—a juicy mix of blood orange, red berries and cherries. There's a certain stiffness to the tannins still, but overall it's finely proportioned and should be enjoyable through the mid-2020s.","Sojourner Vineyard Pommard Clone",91,65,Oregon,"Eola-Amity Hills","Willamette Valley","Paul Gregutt",@paulgwine ,"Owen Roe 2014 Sojourner Vineyard Pommard Clone Pinot Noir (Eola-Amity Hills)","Pinot Noir","Owen Roe",www.owenroe.com
US,"It's rare to get a wine at this price from this appellation. And what's a winery whose name is synonymous with Sonoma Valley doing out on the cold coast? A Pinot that straddles the two regions, this is a fascinating wine, with sumptuous blackberry fruit and an exciting edge of minty tartness. Fantastic value in Pinot Noir. Best Buy.","Sonoma County Selection",91,15,California,"Sonoma Coast",Sonoma,NULL,NULL,"Sebastiani 2001 Sonoma County Selection Pinot Noir (Sonoma Coast)","Pinot Noir",Sebastiani,www.sebastiani.com
US,"Lane Tanner makes sexy wines. You're not supposed to say so, but there it is. This wine brings to mind silk and velvet. Something about it shimmers. It's also delicious, so full of opulent berry fruit you want to swirl it around your mouth forever before you swallow. Fortunately, you can always take another sip. Editors' Choice.","Bien Nacido Vineyard",91,28,California,"Santa Maria Valley","Central Coast",NULL,NULL,"Lane Tanner 2000 Bien Nacido Vineyard Pinot Noir (Santa Maria Valley)","Pinot Noir","Lane Tanner",www.sbwines.com/LaneTannerNews.html
US,"Lavish violet perfume introduces this demure yet luminous Pinot Noir. Crisp black cherry and berry flavors are full of tartness and vibe, yet edged by soft tones of toast and earth, along with a fine frame of tannins. The finish meanders beautifully. It's ready to drink now but should continue to drink well until at least 2023.",NULL,91,18,"New York","Finger Lakes","Finger Lakes","Anna Lee C. Iijima",NULL,"Thirsty Owl Wine Company 2015 Pinot Noir (Finger Lakes)","Pinot Noir","Thirsty Owl Wine Company",www.thirstyowl.com
US,"Layered tannin wraps around smoky oak and big flavors of marshmallow in this full-bodied densely concentrated wine from the well-known site. Black cherry, earthy forest floor and classic cola combine to form a juicy core of succulence beneath the power.","Gap's Crown Vineyard",91,70,California,"Sonoma Coast",Sonoma,"Virginie Boone",@vboone,"Patz & Hall 2015 Gap's Crown Vineyard Pinot Noir (Sonoma Coast)","Pinot Noir","Patz & Hall",www.patzhall.com
US,"Light in color, with depth and clarity, this wine shines with dusty black cherry and pomegranate flavors and an ethereal texture of tension and earthy acidity. Clove and orange zest touches dot the long finish.","Cuvée de Trois",91,35,California,"Russian River Valley",Sonoma,"Virginie Boone",@vboone,"Joseph Swan Vineyards 2013 Cuvée de Trois Pinot Noir (Russian River Valley)","Pinot Noir","Joseph Swan Vineyards",www.swanwinery.com
US,"Light red berries, red plums and cinnamon greet the nose on this countywide blend from Brian Loring, whose tasting room is in Buellton on Highway 246. Brown spice powers the palate, with more cinnamon, star anise and cloves, making for a food-friendly wine.",NULL,91,27,California,"Santa Barbara County","Central Coast","Matt Kettmann",@mattkettmann,"Loring Wine Company 2013 Pinot Noir (Santa Barbara County)","Pinot Noir","Loring Wine Company",www.loringwinecompany.com
US,"Light, quiet layers of spice persist in this elegant, soft yet refined wine. Rose petal, orange, cherry and rhubarb flavors provide subtle fruitiness, supported by vibrant acidity and unobtrusive oak.","Toyon Farm",91,62,California,Carneros,Napa-Sonoma,"Virginie Boone",@vboone,"Saintsbury 2015 Toyon Farm Pinot Noir (Carneros)","Pinot Noir",Saintsbury,www.saintsbury.com
US,"Made from a single clone, this exuberant effort zeroes in on pure cherry-pie and red currant flavors, enhanced by sweet-tasting, smoky oak. There's a slight funkiness that adds to the complexity. Easy to like now, and it will gain traction under proper cellar conditions for 5–6 years.","Clonal Series Dijon 777",91,55,California,Carneros,Napa-Sonoma,NULL,NULL,"Domaine Carneros 2010 Clonal Series Dijon 777 Pinot Noir (Carneros)","Pinot Noir","Domaine Carneros",www.domaine.com
US,"Made in small quantities, this block-specific wine is lush and juicy in black cherry and raspberry, offering a classic expression of the appellation. Round and enticing, it suggests cola spice and black tea in undulating layers, finishing with a taste of creamy vanilla.","Starr Ridge Vineyard Amber Block",91,58,California,"Russian River Valley",Sonoma,"Virginie Boone",@vboone,"Stuhlmuller Vineyards 2012 Starr Ridge Vineyard Amber Block Pinot Noir (Russian River Valley)","Pinot Noir","Stuhlmuller Vineyards",www.stuhlmullervineyards.com
US,"Most Pinot Noirs would kill to have this depth of flavor. Although it's the winery's most basic, non-vineyard-designated Pinot, it's a fantastic wine, rich, mellow and delicious. Offers wave after wave of cherries, currants, cola, pomegranates and persimmons that are as sweet as jam, yet the finish is thoroughly dry. The wine is a masterful blend of seven vineyards. Drink now–2014.",NULL,91,45,California,"Russian River Valley",Sonoma,NULL,NULL,"Merry Edwards 2010 Pinot Noir (Russian River Valley)","Pinot Noir","Merry Edwards",www.merryedwards.com
US,"Norman Beko saves library wines for his fans to enjoy, and this bottling, which shows its age yet remains interesting, is one great example. Kirsch, leather, charred wood and cola aromas lead to a palate laced with hibiscus, cherry paste, hoisin and earthy spice. It is nearly past its prime, so drink up.","Michelle's Hillside Signature Estate",91,48,California,"Santa Maria Valley","Central Coast","Matt Kettmann",@mattkettmann,"Cottonwood Canyon 2008 Michelle's Hillside Signature Estate Pinot Noir (Santa Maria Valley)","Pinot Noir","Cottonwood Canyon",www.cottonwoodcanyon.com
US,"Planted in 1983, this is the original Willamette Valley Vineyards estate vineyard. The wine remains stiff and wrapped up tight, with a mix of wild strawberry, raspberry and cherry fruit. There's a light dusting of baking spices, the result of aging 14 months in one-quarter new French oak.","Bernau Block",91,65,Oregon,"Willamette Valley","Willamette Valley","Paul Gregutt",@paulgwine ,"Willamette Valley Vineyards 2014 Bernau Block Pinot Noir (Willamette Valley)","Pinot Noir","Willamette Valley Vineyards",www.wvv.com
US,"Planted in 1983, this is the original Willamette Valley Vineyards estate vineyard. These old vines give an extra dollop of herb and stem, well integrated into concentrated raspberry and cherry fruit. This has the tannic muscle and acid underpinning to age well. Drink now–2025.","Bernau Block",91,55,Oregon,"Willamette Valley","Willamette Valley","Paul Gregutt",@paulgwine ,"Willamette Valley Vineyards 2013 Bernau Block Pinot Noir (Willamette Valley)","Pinot Noir","Willamette Valley Vineyards",www.wvv.com
US,"Rocky gravel meets plum blossoms, strawberry jam, cola and nutmeg on the nose of this single-vineyard expression by winemaker Brian Loring. Once sipped, dark and rich pomegranate and olallieberry fruit takes hold, with graphite minerality making a splash midpalate.","Kessler-Haak Vineyard",91,50,California,"Sta. Rita Hills","Central Coast","Matt Kettmann",@mattkettmann,"Loring Wine Company 2014 Kessler-Haak Vineyard Pinot Noir (Sta. Rita Hills)","Pinot Noir","Loring Wine Company",www.loringwinecompany.com
US,"Rounded strawberry, orange peel, tart black raspberry and a touch of juniper pop on the nose of this appellation blend by members of the pioneering Bargetto family. Black plum skins, crushed slate, raspberry juice and fresh-picked thyme show on the palate.","Library Selection Estate",91,40,California,"Santa Cruz Mountains","Central Coast","Matt Kettmann",@mattkettmann,"Soquel Vineyards 2013 Library Selection Estate Pinot Noir (Santa Cruz Mountains)","Pinot Noir","Soquel Vineyards",www.soquelvineyards.com
US,"Sleek and elegant, showing a great sense of control, the cherry and currant fruits are strong, yet restrained, pulled in by crisp acidity and taut tannins. It should develop over the next six years or so.","Hallberg Vineyard",91,55,California,"Russian River Valley",Sonoma,NULL,NULL,"Gary Farrell 2009 Hallberg Vineyard Pinot Noir (Russian River Valley)","Pinot Noir","Gary Farrell",www.garyfarrellwines.com
US,"Starr Ridge is a two-block site originally planted by winemaker Gary Farrell and farmed by Ulises Valdez. This Cooper Block is incredibly structured and lengthy on the palate, a rich expression of strawberry, high-toned citrus and anise. Playing supporting roles are earth and forest floor.","Cooper Block Starr Ridge",91,58,California,"Russian River Valley",Sonoma,"Virginie Boone",@vboone,"Stuhlmuller Vineyards 2012 Cooper Block Starr Ridge Pinot Noir (Russian River Valley)","Pinot Noir","Stuhlmuller Vineyards",www.stuhlmullervineyards.com
US,"Stewed black plum and tangy black cherry fruit meet baking spice and cola on the nose of this bottling from Lompoc-based Brian Loring. The palate is tangy with black cherry and cranberry, with a touch of herbs and forest floor.","Kessler-Haak Vineyard",91,54,California,"Sta. Rita Hills","Central Coast","Matt Kettmann",@mattkettmann,"Loring Wine Company 2015 Kessler-Haak Vineyard Pinot Noir (Sta. Rita Hills)","Pinot Noir","Loring Wine Company",www.loringwinecompany.com
US,"Strawberry and a rich streak of raspberry liqueur play nice in this fresh, zesty Pinot. Tight with tension on the palate, it also features layers of earthy forest-floor mushroom. Big in style, it comes together nicely and makes for an enjoyable wine.",NULL,91,48,California,"Sonoma Coast",Sonoma,"Virginie Boone",@vboone,"Terra Valentine 2012 Pinot Noir (Sonoma Coast)","Pinot Noir","Terra Valentine",www.terravalentine.com
US,"Strawberry and thyme show strongly on the nose of this bottling, as does a slate minerality and violet florality. It's soft and lush on the palate with dried strawberry, plum, black raspberry and a vanilla richness, but the wet-slate earthiness shines throughout.","Partners' Reserve Library Selection",91,56,California,"Santa Cruz Mountains","Central Coast","Matt Kettmann",@mattkettmann,"Soquel Vineyards 2013 Partners' Reserve Library Selection Pinot Noir (Santa Cruz Mountains)","Pinot Noir","Soquel Vineyards",www.soquelvineyards.com
US,"Strawberry jam and red cherries meet vanilla and nutmeg in this fresh, fruity but also complex wine. It is medium-bodied and just slightly tannic in the texture, which is a good thing. It has a great sense of harmony that lasts through the finish.","Confluence Vineyard",91,82,California,"Anderson Valley",NULL,"Jim Gordon",@gordone_cellars,"Goldeneye 2013 Confluence Vineyard Pinot Noir (Anderson Valley)","Pinot Noir",Goldeneye,www.goldeneyewinery.com
US,"The best of the 2009 lineup from Willamette Valley Vineyards, this Eola-Amity Hills single-vineyard offering has the most complexity, in both nose and mouthfeel. Balanced fruits fill the palate, with spicy hints of earth, leaf and a wash of barrel-induced mocha.",Elton,91,45,Oregon,"Eola-Amity Hills","Willamette Valley","Paul Gregutt",@paulgwine ,"Willamette Valley Vineyards 2009 Elton Pinot Noir (Eola-Amity Hills)","Pinot Noir","Willamette Valley Vineyards",www.wvv.com
US,"The dark garnet color seems right for a wine that smells like black cherries and black-skinned plums, and tastes deep and rich. Both the flavors and the texture seem shaped by subtly spicy oak. Fine-grained tannins add a velvety touch and the finish lingers.","Durell Vineyard Hayfield Block",91,48,California,"Sonoma Coast",Sonoma,"Jim Gordon",@gordone_cellars,"Saxon Brown 2012 Durell Vineyard Hayfield Block Pinot Noir (Sonoma Coast)","Pinot Noir","Saxon Brown",www.saxonbrown.com
US,"The fermentation with the stems intact brings some earthy qualities front and center, to good effect. This is the most distinctive entry among the winery's eight Pinots, further enhanced by the use of wild yeasts. Scents of clover and hints of watercress and bark highlight the flavors of beetroot and brambly berry fruit. You will have fun playing this against a variety of potential food matchups.","Whole Cluster Cuvée",91,85,Oregon,"Dundee Hills","Willamette Valley","Paul Gregutt",@paulgwine ,"Archery Summit 2012 Whole Cluster Cuvée Pinot Noir (Dundee Hills)","Pinot Noir","Archery Summit",www.archerysummit.com
US,"The Signature Cuvée opens on a floral note, a pretty and beguiling blend of roses and orchids. The midpalate is substantial and textured, offering spicy plum, strawberry and raspberry preserves and firm acids. The fruit flavors persist even as the tannins and barrel notes kick in, offering cocoa, ground coffee and walnut. All in all, an elegant and complex effort that should also age nicely for up to a decade.","Signature Cuvée",91,45,Oregon,"Willamette Valley","Willamette Valley","Paul Gregutt",@paulgwine ,"Willamette Valley Vineyards 2006 Signature Cuvée Pinot Noir (Willamette Valley)","Pinot Noir","Willamette Valley Vineyards",www.wvv.com
US,"The tannins and acids are pushy on this young Pinot, making it tough to appreciate now despite rich, savory raspberry, persimmon, rose and clove flavors. Give it three or four years in the cellar to let it mellow.","Hyde Vineyard",91,65,California,Carneros,Napa-Sonoma,NULL,NULL,"Patz & Hall 2011 Hyde Vineyard Pinot Noir (Carneros)","Pinot Noir","Patz & Hall",www.patzhall.com
US,"The vineyard is near if not entirely within the Arroyo Grande Valley appellation, and it shows that region's tannins, acidity and ripe, long hangtime flavors. The balanced 2012 vintage has given it tremendously ripe cherry, raspberry, red currant and cola flavors, yet the wine retains an exciting sense of control and balance. Give it until 2018–2019 in the cellar to gain traction.","Aubaine Vineyard",91,50,California,"San Luis Obispo County","Central Coast",NULL,NULL,"Loring Wine Company 2012 Aubaine Vineyard Pinot Noir (San Luis Obispo County)","Pinot Noir","Loring Wine Company",www.loringwinecompany.com
