Country,Description,Designation,Points,Price,State,Region_1,Region_2,Taster_Name,Taster_Twitter,Title,Variety,Winery,Website
US,"Young, tart and wrapped up tight as a drum, this offers sharp flavors of cranberry and a bit of Campari. It has the heft and polish to open up further with some additional bottle age, but it isn't budging at the moment.",Estate,89,40,Oregon,"Willamette Valley","Willamette Valley","Paul Gregutt",@paulgwine ,"Willamette Valley Vineyards 2009 Estate Pinot Noir (Willamette Valley)","Pinot Noir","Willamette Valley Vineyards",www.wvv.com
US,"A fairly subdued, mostly mineral-driven nose characterizes this wine by the Santa Clara Valley-based producer founded in 1978, with bits of brick and graphite most prevalent. The flavors are more prominent, with allspice-laced cherries, toasted oak and iron.",NULL,88,32,California,"Santa Lucia Highlands","Central Coast","Matt Kettmann",@mattkettmann,"Sarah's Vineyard 2012 Pinot Noir (Santa Lucia Highlands)","Pinot Noir","Sarah's Vineyard",sarahs-vineyard.com
US,"A fruit forward Pinot, like an orchard in the mouth, offering sweet, ripe raspberries, cherries, red plums and spices. There's a smoked meat streak that adds complexity. A nice, fancy wine for a house pour.",NULL,88,26,California,Carneros,Napa-Sonoma,NULL,NULL,"Sebastiani 2009 Pinot Noir (Carneros)","Pinot Noir",Sebastiani,www.sebastiani.com
US,"A generous expression of full-bodied fruit and oak, this wine is ripe in black cherry, plum and black licorice, robust and flavorful. The finish offers integrated tannins with a hint of cinnamon spice.",NULL,88,70,California,"Russian River Valley",Sonoma,"Virginie Boone",@vboone,"Chateau St. Jean 2012 Pinot Noir (Russian River Valley)","Pinot Noir","Chateau St. Jean",www.chateaustjean.com
US,"A heavy chaparral element consumes the nose of this wine, with sagebrush, eucalyptus, pencil lead and just a touch of elderberry fruit. The palate is all about tart cranberries and sour cherries, with a bit of graphite minerality holding it together. It's a brisk and earthy sipper.",NULL,88,25,California,"Sta. Rita Hills","Central Coast","Matt Kettmann",@mattkettmann,"Santa Barbara Winery 2013 Pinot Noir (Sta. Rita Hills)","Pinot Noir","Santa Barbara Winery",www.sbwinery.com
US,"A reserve selection from the winery's Jordan Block, this brings similar flavors with slightly more intensity. Black fruits, black pepper and some spice from barrel aging combine in a medium-bodied effort with moderate aging potential.","Barrel Select",88,50,Oregon,McMinnville,"Willamette Valley","Paul Gregutt",@paulgwine ,"Youngberg Hill Vineyards 2006 Barrel Select Pinot Noir (McMinnville)","Pinot Noir","Youngberg Hill Vineyards",www.youngberghill.com
US,"A testament to coolness—cool place, cool year—this Marin County Pinot is earthy, round and tight, suggesting it could use a little more time to develop. Cranberry and spice rule the roost and the wine's lightness of being would pair well with fresh-caught salmon not looking to be overwhelmed.","Azaya Ranch Vineyard",88,58,California,"Marin County","North Coast","Virginie Boone",@vboone,"Dutton-Goldfield 2011 Azaya Ranch Vineyard Pinot Noir (Marin County)","Pinot Noir",Dutton-Goldfield,www.duttongoldfield.com
US,"A toasty streak of espresso-flavored richness marks this single-vineyard offering. The fruit is ripe and clean, with a tart red-berry flavor at the core.","Corral Creek Vineyards",88,48,Oregon,"Chehalem Mountains","Willamette Valley","Paul Gregutt",@paulgwine ,"Chehalem 2010 Corral Creek Vineyards Pinot Noir (Chehalem Mountains)","Pinot Noir",Chehalem,www.chehalemwines.com
US,"A very pretty and polished Pinot Noir, soft, silky and delicious, and lovely for drinking now. It shows raspberry, cherry, vanilla and cinnamon flavors, with a kiss of rose petal.",NULL,88,26,California,Carneros,Napa-Sonoma,NULL,NULL,"Sebastiani 2008 Pinot Noir (Carneros)","Pinot Noir",Sebastiani,www.sebastiani.com
US,"Big and flashy, it has oodles of almost sweet oak and ripe fruit character. Full-bodied, rich in texture, with ripe raspberry and red cherry flavors, it offers firm tannins and a lingering, vanilla scented finish.",NULL,88,55,California,"Anderson Valley",NULL,"Jim Gordon",@gordone_cellars,"Goldeneye 2011 Pinot Noir (Anderson Valley)","Pinot Noir",Goldeneye,www.goldeneyewinery.com
US,"Call this Pinot useful, rather than complex or ageable. It's nicely dry, acidic and silky in the mouth, with jammy raspberry, cherry and persimmon flavors. Food pairings range from steak to tuna tartare or a bacon burger.",NULL,88,40,California,"Russian River Valley",Sonoma,NULL,NULL,"La Crema 2012 Pinot Noir (Russian River Valley)","Pinot Noir","La Crema",www.lacrema.com
US,"Crisply defined, this cuvée, from a vineyard well to the north in the Willamette Valley, has highlights of pine and herb. The fruit is a mix of pomegranate and orange peel, sharp and penetrating.","Tualatin Estate",88,45,Oregon,"Willamette Valley","Willamette Valley","Paul Gregutt",@paulgwine ,"Willamette Valley Vineyards 2010 Tualatin Estate Pinot Noir (Willamette Valley)","Pinot Noir","Willamette Valley Vineyards",www.wvv.com
US,"Dark red cherry and raspberry blend with the slightest hints of thyme and slate on the nose of this bottling, which is made in a urban facility in the coastal city of Marina. There is a tangy cran-raspberry element to the sip, enhanced by licorice spice.","Tondre Grapefield",88,45,California,"Santa Lucia Highlands","Central Coast","Matt Kettmann",@mattkettmann,"Cima Collina 2013 Tondre Grapefield Pinot Noir (Santa Lucia Highlands)","Pinot Noir","Cima Collina",www.cimacollina.com
US,"Forward and fruity, this has California-style fruit and sweet, strawberry candy. The difference is that it fills out the middle with some leafy, herbal flavors, nothing too rough, but enough to add some flavor interest. The finish is fat and buttery, showing the influence of oak aging.",Reserve,88,22,Oregon,"Willamette Valley","Willamette Valley","Paul Gregutt",@paulgwine ,"Silvan Ridge 2005 Reserve Pinot Noir (Willamette Valley)","Pinot Noir","Silvan Ridge",www.silvanridge.com
US,"Fragrant and soft, this nicely oaked Pinot Noir offers cherry, cola, mocha and toast flavors. If there is a critique to be made, it is that the finish, though clean and pure, feels just a little flat in the mouth, not as lively as the entry promises.",NULL,88,30,Oregon,"Willamette Valley","Willamette Valley","Paul Gregutt",@paulgwine ,"Daedalus Cellars 2006 Pinot Noir (Willamette Valley)","Pinot Noir","Daedalus Cellars",NULL
US,"Full, fleshy and flavorful, this blend of the three estate vineyards offers pretty fruit flavors of strawberry and Bing cherry. It carries a whiff of white pepper, along with luscious, orange-tinged acidity.","Three Vineyard",88,32,Oregon,"Willamette Valley","Willamette Valley","Paul Gregutt",@paulgwine ,"Chehalem 2012 Three Vineyard Pinot Noir (Willamette Valley)","Pinot Noir",Chehalem,www.chehalemwines.com
US,"Here is a well-focused wine with appealing toastiness as soon as it's opened. Fruit flavors are still tight, but unfold into tangy raspberry. It spent 18 months in half new French oak, to good effect.","Roads End Estate Vineyard",88,45,Oregon,"Willamette Valley",NULL,"Paul Gregutt",@paulgwine ,"Carlton Cellars 2011 Roads End Estate Vineyard Pinot Noir","Pinot Noir","Carlton Cellars",www.carltoncellars.com
US,"Here's a big, rich, thick Pinot that almost seems more like a southern Rhône wine, it's that dark and full-bodied. The flavors are ripe and jammy, of pie-filling black cherries, black raspberries, cola, anise and smoky oak.",Precioso,88,75,California,"Sonoma Coast",Sonoma,NULL,NULL,"Keller Estate 2006 Precioso Pinot Noir (Sonoma Coast)","Pinot Noir","Keller Estate",www.kellerestate.com
US,"Light and forward, this pleasant, single vineyard selection opens with pretty raspberry and black cherry fruit and an impression of spritziness. The flavors suggest Campari, with light streaks of herb and anise.","Corral Creek Vineyards",88,50,Oregon,"Chehalem Mountains","Willamette Valley","Paul Gregutt",@paulgwine ,"Chehalem 2011 Corral Creek Vineyards Pinot Noir (Chehalem Mountains)","Pinot Noir",Chehalem,www.chehalemwines.com
US,"Listed as well in excess of 15% alcohol, this is sourced from a single vineyard in a hot year. The grapes were left to hang while sugars rose precipitously. Flavors suggest mincemeat pie, brown sugar and root beer. Not typical, but tasty enough. Drink over the next year for peak flavor.",NULL,88,28,Oregon,"Willamette Valley",NULL,"Paul Gregutt",@paulgwine ,"Animale 2014 Pinot Noir","Pinot Noir",Animale,www.animalewine.com
US,"Made by a winery outside of Gilroy, this bottling from eastern Salinas Valley fruit brings very nice aromas of blackberry extract, baking spices, gingerbread and a hint of root beer. The flavors are full and rich as the nose predicts, with juicy cherry-chocolate, a touch of tobacco and lingering cinnamon spice.",NULL,88,32,California,Chalone,"Central Coast","Matt Kettmann",@mattkettmann,"Sarah's Vineyard 2012 Pinot Noir (Chalone)","Pinot Noir","Sarah's Vineyard",sarahs-vineyard.com
US,"One of Brian Loring's always solid appellation blends, this one packs sour cherry and cranberry on the nose, with plenty of crushed sage and dried garden herbs, picking up more black cherry as time goes on. Pencil lead, buttered red cherry, oregano and bay leaf play into the grippy palate.",NULL,88,36,California,"Santa Lucia Highlands","Central Coast","Matt Kettmann",@mattkettmann,"Loring Wine Company 2014 Pinot Noir (Santa Lucia Highlands)","Pinot Noir","Loring Wine Company",www.loringwinecompany.com
US,"One of Oregon's better Pinot Noir values year after year is this basic bottling from Willamette Valley Vineyards. The 2006 is quite spicy with peppery highlights, and the red fruits are sleek and tart, though not green or thin. The core brings warm, somewhat round fruit flavors of pie cherry, plum, and a hint of toast from 20% new Allier barrels.",NULL,88,25,Oregon,"Willamette Valley","Willamette Valley","Paul Gregutt",@paulgwine ,"Willamette Valley Vineyards 2006 Pinot Noir (Willamette Valley)","Pinot Noir","Willamette Valley Vineyards",www.wvv.com
US,"Only occasionally produced, this reserve-level wine is a bit of a mystery in this new vintage. It's tart and shy, its black fruit laced with assertive acidity and its finish excessively astringent.",Statement,88,99,Oregon,"Ribbon Ridge","Willamette Valley","Paul Gregutt",@paulgwine ,"Chehalem 2014 Statement Pinot Noir (Ribbon Ridge)","Pinot Noir",Chehalem,www.chehalemwines.com
US,"Pine forest and tart, lean drops of cranberry, rhubarb and pomegranate combine for a complex, savory and compelling vineyard-designate. A strong presence of tannin marks the finish.","La Cruz Vineyard",88,45,California,"Sonoma Coast",Sonoma,"Virginie Boone",@vboone,"Keller Estate 2013 La Cruz Vineyard Pinot Noir (Sonoma Coast)","Pinot Noir","Keller Estate",www.kellerestate.com
US,"Plum and grape aromas kick off this bottling from Brian Loring, accented by clove, Indian spice and crushed cinnamon. Stewed black plum, peppercorn, turned earth and broad fruit flavors combine in a somewhat muddy formation on the palate.","Clos Pepe Vineyard",88,54,California,"Sta. Rita Hills","Central Coast","Matt Kettmann",@mattkettmann,"Loring Wine Company 2015 Clos Pepe Vineyard Pinot Noir (Sta. Rita Hills)","Pinot Noir","Loring Wine Company",www.loringwinecompany.com
US,"Red plum, kirsch, eucalyptus and baking spice show on the nose of this bottling from a vineyard on the inland eastern side of the appellation. The palate offers juniper, pine, loam and tea flavors against the bright red cherry fruit, with an encompassing acidity that is strong but not searing.","Imagination Reserve Sebastianio Vineyards",88,60,California,"Sta. Rita Hills","Central Coast","Matt Kettmann",@mattkettmann,"Hunt Cellars 2014 Imagination Reserve Sebastianio Vineyards Pinot Noir (Sta. Rita Hills)","Pinot Noir","Hunt Cellars",www.huntwinecellars.com
US,"Rich and heavy, like a chocolate pastry dessert with blueberry, raspberry and cherry fruit. You could even describe it as decadent, but it lacks elegance and lively complexity. Drink now, after a good decant.","Chenoweth Ranch",88,55,California,"Russian River Valley",Sonoma,NULL,NULL,"Patz & Hall 2009 Chenoweth Ranch Pinot Noir (Russian River Valley)","Pinot Noir","Patz & Hall",www.patzhall.com
US,"Rich, full-bodied and heavy, this is dramatic in its own way. It's certainly ripe and thick, with a flavor of black raspberry jam and a touch of milk chocolate. The high alcohol is suggestive of cherry liqueur. But that's been the Chenoweth Ranch signature for years. Drink now.","Chenoweth Ranch",88,58,California,"Russian River Valley",Sonoma,NULL,NULL,"Patz & Hall 2010 Chenoweth Ranch Pinot Noir (Russian River Valley)","Pinot Noir","Patz & Hall",www.patzhall.com
US,"Shows the classic structure of a fine Russian River Pinot, and Merry Edwards' way of making everything elegant. Dry and crisp, the wine displays cherry pulp and skin, cola, anise and spice flavors, wrapped into ultra-refined, velvety tannins. Doesn't seem to have the fruity focus and concentration of recent vintages, though, so drink soon.","Olivet Lane",88,60,California,"Russian River Valley",Sonoma,NULL,NULL,"Merry Edwards 2006 Olivet Lane Pinot Noir (Russian River Valley)","Pinot Noir","Merry Edwards",www.merryedwards.com
US,"Sporting a much-improved label design, the 2009 Natasha brings pungent, assertive scents of tomato leaf, pepper and moist earth. Sharp and focused, the fruit is there, though it's the leaf and earth components that stand out. For its earthy style, it's a well-made and complex offering.",Natasha,88,40,Oregon,"Willamette Valley","Willamette Valley","Paul Gregutt",@paulgwine ,"Youngberg Hill Vineyards 2009 Natasha Pinot Noir (Willamette Valley)","Pinot Noir","Youngberg Hill Vineyards",www.youngberghill.com
US,"Succulent pomegranate, persimmon and raspberry flavors make this wine an instant delight. The richness is brightened by tart acidity, while oak brings just the right touch of buttered cinnamon toast. A lovely Pinot Noir for drinking now with upscale fare.",NULL,88,32,California,"Russian River Valley",Sonoma,NULL,NULL,"Loring Wine Company 2012 Pinot Noir (Russian River Valley)","Pinot Noir","Loring Wine Company",www.loringwinecompany.com
US,"The most promising Pinots from this central Monterey County appellation, and this is definitely one of them, continue to show its promise. This is one of the few that goes beyond simple fruit and acidity into complexity. It's not an ager, but the raspberries and cherries, accented with acidity and oak, make it a fine partner now for steak, lamb, tuna or an elaborate mushroom risotto.","Panorama Vineyard",88,35,California,"Arroyo Seco","Central Coast",NULL,NULL,"Carmel Road 2011 Panorama Vineyard Pinot Noir (Arroyo Seco)","Pinot Noir","Carmel Road",www.carmelroad.com
US,"The Stoller-sourced Pinot is forward and ripe, with pretty fruit flavors in a compact, light vintage. Cola, peach, black cherry and milk chocolate components swirl together, fading gently into a light finish. Drink over the next 2–3 years.","Stoller Vineyards",88,50,Oregon,"Dundee Hills","Willamette Valley","Paul Gregutt",@paulgwine ,"Chehalem 2011 Stoller Vineyards Pinot Noir (Dundee Hills)","Pinot Noir",Chehalem,www.chehalemwines.com
US,"The winery identifies this as their reserve-level wine, giving it 14 months in 50% new French oak barrels. Raspberry and cherry flavors are prominent, along with scents and flavors of cookie dough. The wine has moderate depth and length, although the tannins turn a little bitter. Some additional bottle age should help smooth it out.","Signature Cuvée",88,60,Oregon,"Willamette Valley","Willamette Valley","Paul Gregutt",@paulgwine ,"Willamette Valley Vineyards 2011 Signature Cuvée Pinot Noir (Willamette Valley)","Pinot Noir","Willamette Valley Vineyards",www.wvv.com
US,"There is, as usual with Pinots from Garys', a lusty, almost overwhelming quality to the wine. It's a full frontal assault of flavor, with cascades of cherries, raspberries, cola, licorice, sweet leather and smoky char that go on and on. It's an achievement, but what the wine has in directness, it's missing in subtlety. Drink this big, bold California Pinot Noir now, or hold through 2010.","Garys' Vineyard",88,50,California,"Santa Lucia Highlands","Central Coast",NULL,NULL,"Loring Wine Company 2006 Garys' Vineyard Pinot Noir (Santa Lucia Highlands)","Pinot Noir","Loring Wine Company",www.loringwinecompany.com
US,"There's some muscle and meat to this tight young wine, with black raspberry and cherry fruits. But those flavors feel squeezed by the chalky sour-lemon acidity, which may or may not soften with additional bottle age.","Stoller Vineyards",88,50,Oregon,"Dundee Hills","Willamette Valley","Paul Gregutt",@paulgwine ,"Chehalem 2014 Stoller Vineyards Pinot Noir (Dundee Hills)","Pinot Noir",Chehalem,www.chehalemwines.com
US,"This  Pinot Noir has deep flavors of cherry and persimmon, plus a lush application of sweet oak. It has a sandpaper-like mouthfeel, and it might benefit from a few years in a cellar. Otherwise, decant it for a couple hours before serving.","Dutton Ranch",88,40,California,"Russian River Valley",Sonoma,NULL,NULL,"Dutton-Goldfield 2011 Dutton Ranch Pinot Noir (Russian River Valley)","Pinot Noir",Dutton-Goldfield,www.duttongoldfield.com
US,"This blend of the three estate vineyards is the first Pinot to be released from each vintage. Here it spent time in 22% oak, roughly half new. Cranberry, pomengranate, dried herbs and some gently earthy tannins combine in a tart, gulpable style.","Three Vineyard",88,32,Oregon,"Willamette Valley","Willamette Valley","Paul Gregutt",@paulgwine ,"Chehalem 2013 Three Vineyard Pinot Noir (Willamette Valley)","Pinot Noir",Chehalem,www.chehalemwines.com
US,"This is a powerfully earthy and rustic Pinot soft in tannin structure and exuberant in ripe dark cherry and berry, a touch of savory leather and tobacco peaking on the finish.",NULL,88,40,California,"Los Carneros",Napa-Sonoma,"Virginie Boone",@vboone,"La Crema 2012 Pinot Noir (Los Carneros)","Pinot Noir","La Crema",www.lacrema.com
US,"This is a rich, broad-shouldered Pinot Noir, woodsy and oaky with a firm and fierce grip on the palate. It leans more toward earth and smoke than exuberant fruit. Textured in soft undertones of silk, it also offers plenty of fresh herb, a component to take advantage of in pairing.","Brown Ranch",88,72,California,Carneros,Napa-Sonoma,"Virginie Boone",@vboone,"Saintsbury 2011 Brown Ranch Pinot Noir (Carneros)","Pinot Noir",Saintsbury,www.saintsbury.com
US,"This is a young, meaty Pinot, a bottle of substantial red cherry, earthy mushroom and soil that's bright and layered with a heartiness to the texture and finish. The back label mentions that the grapes were sourced from Bacigalupi Vineyards, a longstanding star in the Russian River Valley.",Lucie,88,60,California,"Russian River Valley",Sonoma,"Virginie Boone",@vboone,"Bacio Divino 2012 Lucie Pinot Noir (Russian River Valley)","Pinot Noir","Bacio Divino",www.baciodivino.com
US,"This is from the vineyard that surrounds the winery, and the bottling receives both Estate and Dundee Hills designations—best of the best. It's a pungent, pleasant wine upon entry, with rather pale strawberry fruit. It quickly moves through the midpalate and turns lean, with tomato leaf and green tea astringency. There is a slight impression of alcoholic heat. Though accessible and interesting, it somehow falls short of what it could/should be, given its provenance and price.",Estate,88,150,Oregon,"Dundee Hills","Willamette Valley","Paul Gregutt",@paulgwine ,"Archery Summit 2004 Estate Pinot Noir (Dundee Hills)","Pinot Noir","Archery Summit",www.archerysummit.com
US,"This is the richest and most satisfying of the winery's four 2010 Pinot Noirs. It's not an ager, but the flavors of raspberry and cherry jam are forward and tasty, with a tart edge of spicy licorice. Drink it now for maximum freshness.",NULL,88,30,California,"Russian River Valley",Sonoma,NULL,NULL,"Sebastiani 2010 Pinot Noir (Russian River Valley)","Pinot Noir",Sebastiani,www.sebastiani.com
US,"This organic bottling marks Cooper’s 20th year, and it’s a tantalizing, high-strung, dusty wine, with a true Pinot nose full of raspberries and cinnamon. Plenty of verve on the palate, which emphasizes fruit and more fruit. The frame is sleek, but it capably carries the wine’s zip.","20th Anniversary",88,25,Oregon,"Willamette Valley","Willamette Valley","Michael Schachner",@wineschach,"Cooper Mountain 1998 20th Anniversary Pinot Noir (Willamette Valley)","Pinot Noir","Cooper Mountain",www.coopermountainwine.com
US,"This smoky, dusty wine seems to be chugging quickly along the aging curve. At the moment, it's drinking nicely, decked out with pretty baking spice and mocha highlights. It's smooth and mouth filling, with lots of pretty cherry flavor.","Three Vineyard",88,27,Oregon,"Willamette Valley","Willamette Valley","Paul Gregutt",@paulgwine ,"Chehalem 2010 Three Vineyard Pinot Noir (Willamette Valley)","Pinot Noir",Chehalem,www.chehalemwines.com
US,"This tastes soft and simple now, although considering the vineyard sourcing, that could be misleading. There's a core of raspberry and cherry fruit, with intriguing forest notes of dried pine needles and mushrooms. The acidity is just right, neither bright nor too soft. The wine isn't showing much now, but could be a sleeper. Try after 2015.","Durell Vineyard Hayfield Block",88,48,California,"Sonoma Coast",Sonoma,NULL,NULL,"Saxon Brown 2009 Durell Vineyard Hayfield Block Pinot Noir (Sonoma Coast)","Pinot Noir","Saxon Brown",www.saxonbrown.com
US,"This wine is somewhat shy in aroma, with rust, light raspberry, cherry, gravel, dust and a slight cola element arising with patience. Bright red-cherry fruit and hibiscus shows on the sip, yet it's a tad dried out. Slate and riverstone touches add minerality, and the structure is defined by a rocky grip.","Panorama Vineyard",88,35,California,"Arroyo Seco","Central Coast","Matt Kettmann",@mattkettmann,"Carmel Road 2013 Panorama Vineyard Pinot Noir (Arroyo Seco)","Pinot Noir","Carmel Road",www.carmelroad.com
US,"This young wine offers fresh raspberry and pomegranate scents on the lively, simple nose, with dashes of anise and wet slate. Those bright red fruit flavors show on the palate, too, seasoned with thyme and bay leaf and finishing clean.",NULL,88,44,California,"Santa Cruz Mountains","Central Coast","Matt Kettmann",@mattkettmann,"Sarah's Vineyard 2015 Pinot Noir (Santa Cruz Mountains)","Pinot Noir","Sarah's Vineyard",sarahs-vineyard.com
US,"Though not known as a particularly cool region, the hills southwest of San Jose turn out solid Pinot Noirs for this winery. Aromas recall olives, forest floor and cloves, and flavors are quite smooth, with buttered cherries, peppery spice, cola and vibrant acidity that cuts a clean, quick finish.",Estate,88,36,California,"Santa Clara Valley","Central Coast","Matt Kettmann",@mattkettmann,"Sarah's Vineyard 2011 Estate Pinot Noir (Santa Clara Valley)","Pinot Noir","Sarah's Vineyard",sarahs-vineyard.com
US,"Tons of fruit in this easy, direct Pinot Noir. Raspberry, cherry, pomegranate, persimmon and cola begins to describe it, further sweetened by smoky, caramelized oak. Rich and crisp, if a little one-dimensional. But it's a really nice dimension.","Gap's Crown Vineyard",88,70,California,"Sonoma Coast",Sonoma,NULL,NULL,"Patz & Hall 2008 Gap's Crown Vineyard Pinot Noir (Sonoma Coast)","Pinot Noir","Patz & Hall",www.patzhall.com
US,"While initially closed, suggesting a bit more bramble than fruit, a brief aeration coaxes pretty strawberry and cherry aromas from this full-bodied rosé. It's dry in style with crisp cutting acidity and a clean finish.","Rosé of",88,20,"New York","New York","New York Other","Anna Lee C. Iijima",NULL,"Raphael 2016 Rosé of Pinot Noir (New York)","Pinot Noir",Raphael,www.raphaelwine.com
US,"A good Pinot Noir, dry and elegantly structured, with flavors of cherries, currants and oak. Turns a bit sharp as you taste, with a bite of acidity. Will foil well against a juicy steak. The grapes were organically certified.",NULL,87,35,California,Carneros,Napa-Sonoma,NULL,NULL,"Domaine Carneros 2008 Pinot Noir (Carneros)","Pinot Noir","Domaine Carneros",www.domaine.com
US,"A nice, Beaune-style Pinot, rich in cherry and spice fruit, with good oak and medium-bodied. It's balanced in acids and tannins, with a smooth mouth feel, a good food wine.","Flood Family Vineyards",87,30,California,"Santa Barbara County","Central Coast",NULL,NULL,"Rancho Sisquoc 2002 Flood Family Vineyards Pinot Noir (Santa Barbara County)","Pinot Noir","Rancho Sisquoc",www.ranchosisquoc.com
US,"A problematic wine, especially considering the price. It's dark in color, quite tannic and bone dry, with powerful cherry and cola flavors, liberally accented with smoky oak. Has all the hallmarks of an ageable young Pinot Noir, but there's a stubbornly unripe streak of green peppercorn all the way through. Difficult and risky to predict where this wine is going.","Nine Barrel",87,90,California,"Russian River Valley",Sonoma,NULL,NULL,"La Crema 2008 Nine Barrel Pinot Noir (Russian River Valley)","Pinot Noir","La Crema",www.lacrema.com
US,"A slightly redder shade of pink, this bottling offers strawberry gum and watermelon juice aromas, which play toward the juicier style of rosé. There is solid zip on the sip, cutting through the riper flavors of plum and orange peel.","Rosé of",87,19,California,Monterey,"Central Coast","Matt Kettmann",@mattkettmann,"Scheid Vineyards 2016 Rosé of Pinot Noir (Monterey)","Pinot Noir","Scheid Vineyards",www.scheidvineyards.com
